{
  "module": "hr_timesheet_task_required",
  "source_version": "18.0",
  "target_version": "19.0",
  "scored_at": "2026-05-31T18:20:39.650459+00:00",
  "score": 95.0,
  "band": "Excellent",
  "sub_scores": {
    "manifest_correctness": {
      "score": 1.0,
      "weight": 0.15,
      "expected": 1,
      "achieved": 1,
      "notes": ""
    },
    "api_orm_updates": {
      "score": 0.75,
      "weight": 0.2,
      "expected": 4,
      "achieved": 3,
      "notes": ""
    },
    "view_xml_migration": {
      "score": 1.0,
      "weight": 0.15,
      "expected": 0,
      "achieved": 0,
      "notes": "No XML migration patterns triggered for this module."
    },
    "removed_deprecated": {
      "score": 1.0,
      "weight": 0.1,
      "expected": 0,
      "achieved": 0,
      "notes": "Reference did not delete any source files."
    },
    "tests_discoverable": {
      "score": 1.0,
      "weight": 0.15,
      "expected": 3,
      "achieved": 3,
      "notes": ""
    },
    "code_style": {
      "score": 1.0,
      "weight": 0.1,
      "expected": 1,
      "achieved": 1,
      "notes": "pyflakes: src=6, ref=6, candidate=6 (\u2264 bar 6)"
    },
    "no_spurious_diffs": {
      "score": 1.0,
      "weight": 0.15,
      "expected": 21,
      "achieved": 21,
      "notes": ""
    }
  },
  "agent_diff_vs_reference": {
    "files_changed": [
      "README.rst",
      "i18n/hr_timesheet_task_required.pot",
      "static/description/index.html",
      "tests/test_hr_timesheet_task_required.py",
      "views/project_project.xml"
    ],
    "files_only_in_candidate": [],
    "files_only_in_reference": [],
    "diff_path": "diff.patch"
  },
  "missing_changes": [
    {
      "category": "api_orm_updates",
      "reason_code": "LEGACY_CR_CONTEXT_NOT_REPLACED",
      "detail": "2 reference-removed line(s) still in candidate, e.g. ['class TestHrTimesheetTaskRequired(TransactionCase):', 'from odoo.tests import TransactionCase']",
      "file": "tests/test_hr_timesheet_task_required.py"
    }
  ],
  "extra_changes": [],
  "improvement_prompt": "# Improvement prompt for `hr_timesheet_task_required`\n\nWhen you re-run the migration agent on this module, focus on the\nfollowing gaps the previous run left:\n\n## Weakest rubric categories\n\n- **api_orm_updates** (score `0.75`, weight `0.2`, 3/4 required changes applied)\n- **view_xml_migration** (score `1.00`, weight `0.15`, 0/0 required changes applied)\n\n## Top failure patterns (reason codes)\n\n- `LEGACY_CR_CONTEXT_NOT_REPLACED` \u00d7 1\n\n## Concrete instructions for the next run\n\n- Apply `self._cr` \u2192 `self.env.cr`, `self._context` \u2192 `self.env.context`, drop `@api.multi`/`@api.one`. The rule is marked `auto_apply: false` in the YAML \u2014 promote it to auto-apply for safe cases or stop bailing out.\n"
}
