{
  "module": "project_timesheet_holidays_dynamic_description",
  "source_version": "18.0",
  "target_version": "19.0",
  "scored_at": "2026-05-31T18:20:40.470099+00:00",
  "score": 62.5,
  "band": "Acceptable",
  "sub_scores": {
    "manifest_correctness": {
      "score": 0.5,
      "weight": 0.15,
      "expected": 2,
      "achieved": 1,
      "notes": ""
    },
    "api_orm_updates": {
      "score": 0.0,
      "weight": 0.2,
      "expected": 5,
      "achieved": 0,
      "notes": ""
    },
    "view_xml_migration": {
      "score": 1.0,
      "weight": 0.15,
      "expected": 0,
      "achieved": 0,
      "notes": "No XML migration patterns triggered for this module."
    },
    "removed_deprecated": {
      "score": 0.0,
      "weight": 0.1,
      "expected": 2,
      "achieved": 0,
      "notes": ""
    },
    "tests_discoverable": {
      "score": 1.0,
      "weight": 0.15,
      "expected": 3,
      "achieved": 3,
      "notes": ""
    },
    "code_style": {
      "score": 1.0,
      "weight": 0.1,
      "expected": 1,
      "achieved": 1,
      "notes": "pyflakes: src=4, ref=5, candidate=4 (\u2264 bar 5)"
    },
    "no_spurious_diffs": {
      "score": 1.0,
      "weight": 0.15,
      "expected": 8,
      "achieved": 8,
      "notes": ""
    }
  },
  "agent_diff_vs_reference": {
    "files_changed": [
      "README.rst",
      "__manifest__.py",
      "i18n/project_timesheet_holidays_dynamic_description.pot",
      "models/__init__.py",
      "models/hr_leave.py",
      "readme/USAGE.md",
      "static/description/index.html",
      "tests/test_project_timesheet_holidays_description.py"
    ],
    "files_only_in_candidate": [
      "models/hr_leave_type.py",
      "views/hr_holidays_views.xml"
    ],
    "files_only_in_reference": [
      "models/res_company.py",
      "models/res_config_settings.py",
      "views/res_config_settings_views.xml"
    ],
    "diff_path": "diff.patch"
  },
  "missing_changes": [
    {
      "category": "manifest_correctness",
      "reason_code": "MANIFEST_DEPENDS_DRIFT",
      "detail": "manifest 'data' list differs from reference",
      "file": "__manifest__.py"
    },
    {
      "category": "api_orm_updates",
      "reason_code": "LEGACY_CR_CONTEXT_NOT_REPLACED",
      "detail": "2 reference-removed line(s) still in candidate, e.g. ['    \"data\": [\"views/hr_holidays_views.xml\"],', '    \"installable\": True,']",
      "file": "__manifest__.py"
    },
    {
      "category": "api_orm_updates",
      "reason_code": "LEGACY_CR_CONTEXT_NOT_REPLACED",
      "detail": "1 reference-removed line(s) still in candidate, e.g. ['from . import hr_leave_type']",
      "file": "models/__init__.py"
    },
    {
      "category": "api_orm_updates",
      "reason_code": "LEGACY_CR_CONTEXT_NOT_REPLACED",
      "detail": "1 reference-removed line(s) still in candidate, e.g. ['        if self.holiday_status_id.dynamic_timesheet_description and self.name:']",
      "file": "models/hr_leave.py"
    },
    {
      "category": "api_orm_updates",
      "reason_code": "LEGACY_CR_CONTEXT_NOT_REPLACED",
      "detail": "9 reference-removed line(s) still in candidate, e.g. ['        \"will contains the leave description.\",', '        default=True,', '        help=\"If enabled, timesheets generated from time off \"']",
      "file": "models/hr_leave_type.py"
    },
    {
      "category": "api_orm_updates",
      "reason_code": "LEGACY_CR_CONTEXT_NOT_REPLACED",
      "detail": "9 reference-removed line(s) still in candidate, e.g. ['                \"requires_allocation\": \"no\",', '                \"timesheet_generate\": True,', '                \"timesheet_project_id\": cls.project.id,']",
      "file": "tests/test_project_timesheet_holidays_description.py"
    },
    {
      "category": "removed_deprecated",
      "reason_code": "OTHER",
      "detail": "file should have been deleted in 19.0",
      "file": "models/hr_leave_type.py"
    },
    {
      "category": "removed_deprecated",
      "reason_code": "OTHER",
      "detail": "file should have been deleted in 19.0",
      "file": "views/hr_holidays_views.xml"
    }
  ],
  "extra_changes": [],
  "improvement_prompt": "# Improvement prompt for `project_timesheet_holidays_dynamic_description`\n\nWhen you re-run the migration agent on this module, focus on the\nfollowing gaps the previous run left:\n\n## Weakest rubric categories\n\n- **api_orm_updates** (score `0.00`, weight `0.2`, 0/5 required changes applied)\n- **removed_deprecated** (score `0.00`, weight `0.1`, 0/2 required changes applied)\n- **manifest_correctness** (score `0.50`, weight `0.15`, 1/2 required changes applied)\n\n## Top failure patterns (reason codes)\n\n- `LEGACY_CR_CONTEXT_NOT_REPLACED` \u00d7 5\n- `OTHER` \u00d7 2\n- `MANIFEST_DEPENDS_DRIFT` \u00d7 1\n\n## Concrete instructions for the next run\n\n- Apply `self._cr` \u2192 `self.env.cr`, `self._context` \u2192 `self.env.context`, drop `@api.multi`/`@api.one`. The rule is marked `auto_apply: false` in the YAML \u2014 promote it to auto-apply for safe cases or stop bailing out.\n- Re-evaluate `depends`/`data`/`license`/`external_dependencies` against the target branch; do not blindly preserve the 18.0 manifest.\n"
}
